식별 ID,수집한 플랫폼,수집한 종목,날짜,뉴스 제목,뉴스 내용
0013117598,네이버,한국전력,2025-03-13T14:07:00+09:00,"한전, 국립공원공단과 '산불예방·전력설비 보호' 힘 모은다","국립공원 내 전력설비 안정 운영 협력
산불 초동대응 강화…AI 감시 체계 구축
[세종=뉴시스]한국전력공사가 국립공원공단과 13일 한전 아트센터에서 국립공원 산불예방과 전력설비 보호를 위한 업무협약을 체결했다. 김동철 한전 사장, 주대영 국립공원공단 이사장이다.(사진=한국전력 제공) *재판매 및 DB 금지


[세종=뉴시스]손차민 기자 = 한국전력공사는 13일 한전 아트센터에서 국립공원공단과 국립공원 산불예방 및 전력설비 보호를 위한 업무협약을 체결했다고 밝혔다.

양 기관은 보유한 자원과 정보, 네트워크를 활용해 산불예방을 위해 공동 대응하고 국립공원 내 전력설비의 안정적 운영을 위해 협력하기로 했다.

구체적으로 전력설비와 수목간 안전 이격거리 유지 및 위험수목 관리·제거, 산불감시 인력 공조체계 구축으로 취약지 감시 및 초동대응을 강화한다.

전력설비를 활용한 인공지능(AI) 기반 산불 실시간 감시체계 구축과 주요 탐방로 및 지역행사 등 산불예방 합동 홍보, 국립공원 보존을 위해 공동 노력한다.

김동철 한전 사장은 ""국립공원은 생태계 보전의 핵심이자 국민건강과 행복을 증진시키는 복지공간""이라며 ""이번 업무협약으로 국립공원 보호와 안정적 전력설비 운영이라는 공동의 목표를 더욱 효과적으로 달성할 수 있을 것""이라고 밝혔다."
0000064806,네이버,한국전력,2025-03-13T14:04:00+09:00,"[어바웃 G] 한일시멘트, 주주명부 등장한 싱가포르법인 'HHH글로벌' 살펴보니","기업 지배구조(Governance)를 분석합니다.
/사진 제공=한일시멘트

한일홀딩스와 한일시멘트가 배당을 확대한 가운데 지난해 양사의 신규 주주로 등장한 HHH글로벌유한회사도 혜택을 보게 됐다. 고(故) 허채경 창업주의 4남인 허남섭 한일시멘트 명예회장은 지난해 3분기 자신이 보유한 한일홀딩스 주식 30만주(0.97%)와 한일시멘트 주식 50만주(0.97%)를 HHH글로벌에 증여했다.

HHH글로벌은 싱가포르에 적을 둔 유한회사로 2021년 설립됐다. 허 명예회장의 장남 허정규 씨가 지분 78.26%를 소유하고 있다. 나머지 21.74%는 허 명예회장의 가족회사 한덕개발이 가지고 있다.

한덕개발은 2002년 '차우'로 설립됐다. 서울랜드에서 음식점을 운영하는 법인으로 허 명예회장의 가족이 지분 60% 이상을 보유한 가족회사다. 허 명예회장이 12.16%, 아들 허정규 씨가 40.83%, 딸 허정미 씨가 9.35%를 가졌으며 서울랜드에서 외식업을 하는 ㈜세우리가 나머지 37.66%를 쥐고 있다.

한덕개발은 본업 외에도 녹십자홀딩스, 서울랜드 등의 지분을 보유해 배당으로 수입을 꾸준히 올려왔다. 2019년부터 본격적으로 필라넷, 미디어그룹테이크투, 아롬정보기술 등에 투자하며 투자회사로 변신했다.

최근에는 상장사인 삼성물산, 카카오, SK이노베이션, LG이노텍, 한국전력, 한일시멘트 등에도 투자하며 포트폴리오를 넓히고 있다.

HHH글로벌이 한덕개발 감사보고서에 등장한 것은 2022년이다. 한덕개발은 드라마 제작, 마케팅 사업을 하는 미디어그룹테이크투 주식 11만4000주를 25억원에 HHH글로벌에 매각하고 HHH글로벌 유상증자에 약 30억원(200만 달러)을 출자해 32.26%의 지분을 확보했다.

허 명예회장의 증여는 HHH글로벌을 통해 장남 허정규 씨가 운영하는 회사로의 현금유입을 노린 것으로 보인다. 허 씨는 1991년생으로 2014년 자신의 한일홀딩스 지분 1.51%를 모두 매도하고 주주명부에서 사라졌다.

  HHH글로벌 지배구조
 

HHH글로벌은 일반 경영 컨설팅 서비스를 하는 것으로 알려졌으나 구체적인 사업형태는 알 수 없다. 현재는 싱가포르 오차드타워의 오피스를 임대해 운영되는 것으로 알려졌다.

한일시멘트그룹은 꾸준히 배당금을 늘려가고 있다. 한일홀딩스는 2023년 주당 580원의 현금을 배당했다. 지난해에는 주당 800원을 지급했고 올해는 주당 930원의 배당을 결정했다. 한일시멘트 역시 같은 기간 주당 580원에서 800원, 올해는 1000원으로 배당금이 늘어났다."
0001060476,네이버,한국전력,2025-03-13T06:42:00+09:00,[스타트UP] AI 순찰 로봇이 초기 화재 진압… “전통시장·공장 불 잡는다”,"SBA 제8회 서울혁신챌린지 선정기업
이성진 이롭로보틱스 대표
순찰 로봇…24시간 점검, 초기 화재 진압
서울 전통시장 실증 테스트 완료, 연내 2대 투입

이성진 이롭로보틱스 대표

이롭로보틱스는 전통시장 화재 순찰 로봇, 전력설비 진단 로봇 등을 개발하는 스타트업이다. AI 기술을 적용해 자율주행은 물론 화재 인식, 초기 화재 진압이 가능하다.

이롭로보틱스는 포스코에서 제철 프로세스 공정 고도화 등을 연구한 연구자 출신 이성진 대표가 2020년 12월 창업했다. 포스코에서 30여년간 근무한 이 대표는 포스코 사내 벤처로 화재 순찰 및 전력 진단 로봇 개발에 나섰고, 독립 기업으로 분사했다.

이 대표는 포스코 재직 당시 포스코는 물론 글로벌 경쟁사들이 공장에서 화재가 발생하면 복구 비용은 물론 복구 기간 동안 생산이 중단돼 큰 피해를 입는 것을 보고 AI 로봇 개발에 나섰다.

이 대표는 “대규모 공장에 화재가 발생하면 복구하는 기간만 몇 달 걸리고 그에 따른 몇백억원에 달하는 손해가 발생한다”며 “포스코에 있을 때 생산라인, 전기실 등에서 화재 등을 진압할 수 있는 로봇 설루션을 개발했고, 사업을 키우기 위해 이롭로보틱스를 세웠다”고 말했다.

이롭로보틱스는 현재 전통시장 화재 순찰 로봇과 전력 설비 감시 진단 로봇을 개발해 제품을 출시하고 있다. 두 로봇의 가장 큰 장점은 사람이 아닌 로봇이 24시간 사각지대 없이 모니터링하고, 초기 대응이 가능하다는 점이다.

이롭로보틱스의 전통시장 화재 순찰 로봇

기존 화재 시스템의 경우, 고정식으로 일정 범위 내에서만 감시 및 작동할 수 있고, 낮은 성능으로 인해 오작동되는 경우가 많다. 그러나 이롭로보틱스 로봇은 심야시간 자율주행 무인순찰을 통해 사각지대 없이 전 구역을 감시한다. 특히 AI 기술을 적용해 온도 추적과 화재 인식, 전기 설비 과열 진단은 물론 초기 화재 진압이 가능하다.

이 대표는 “고도의 AI 기능을 탑재해 정확히 화재를 감지, 화재·비화재를 인식할 수 있다”며 “로봇에 달린 에어로졸 고체 소화기를 통해 제품 손상 걱정 없이 소방관보다 먼저 기초 진압을 수행한다”고 설명했다.

이롭로보틱스는 우선 전통시장에 로봇을 서비스해 화재 발생 피해를 줄인다는 계획이다. 화재 순찰 로봇은 2023년 11월부터 2024년 3월까지 강서구 까치산시장, 종로구 광장시장, 구로구 남구로시장, 성동구 마장시장 등 서울 전통시장 4곳에서 실증 테스트를 진행하며 성과를 인정받았다. 제8회 서울혁신챌린지를 통해 전통시장 화재 순찰 로봇 기술 고도화도 진행 중이다. 최근 서울소방재난본부와 화재 순찰 로봇 운영 임대차 계약을 맺고 서울의 전통시장에서 연말까지 2대의 화재 순찰 로봇 투입할 예정이다.

이롭로보틱스는 대규모 시설의 화재 예방을 위한 전력설비 감시 진단 로봇 사업도 강화하고 있다. 지난해에는 한국전력 변전소 실증 테스트를 진행했다. 이 대표는 “현재 국내 다양한 기업에 전력설비 감시 진단 로봇을 설치, 서비스 방안을 논의하고 있다”며 “AI 안전 로봇이 공장 현장은 물론 시장 곳곳을 순찰해 인명, 재산 피해를 방지하는 역할을 할 수 있도록 하겠다”고 말했다."
0000935794,네이버,한국전력,2025-03-13T06:31:00+09:00,"[출향인을 만나다] KBI그룹 박효상 회장 '갑을(甲乙) 신화', 한국 넘어 해외로 뻗어가","'갑을' 창업주 故박재을 회장 차남…80년대 말 본가와 분리·상경해 '갑을 상사 그룹' 일궈
자동차 부품·소재·환경 및 에너지 등 6대 부문 20여 계열사…2024년 기준 총 3조원 매출
'열렬한 스키 사랑' …비인기 스포츠인 '설상 경기' 후원 위해 설상경기연맹 회장 맡아
박효상 KBI그룹 회장은 대구 섬유산업 상징인 '갑을'에서 분리돼 서울로 거점을 옮긴 '갑을상사그룹'을 현재 20여개 계열사를 거느린 글로벌 기업체로 일궈냈다. 이무성 객원기자


'갑을(甲乙)'은 대구 섬유산업 번영기를 이끈 기업이다. IMF이후 대구의 갑을은 경영난으로 무너졌지만, 1980년대 말 갑을에서 계열 분리된 '갑을상사그룹'(현 KBI그룹)은 서울로 거점을 옮긴 후 눈부신 발전을 이어가고 있다. 자동차부품·소재·에너지·의료 등 다양한 부문에 20여개 계열사를 거느리고 있다. 국내 뿐 아니라 해외 시장 개척에 주력한 성과로 지난해 기준 약 3조원 매출을 달성했다.

현재 KBI그룹 경영을 총괄하는 박효상(67) 회장은 갑을 공동창업주인 고 박재을 회장의 차남이다. 1991년 선친이 타계한 이후 그룹을 이끌어온 장남 박유상 부회장이 2015년 고문으로 추대되면서, 박 회장은 동생인 박한상 부회장과 함께 그룹을 이끌고 있다.

이처럼 경영 최일선에 선 박 회장은 (사)대한설상경기연맹 회장을 맡아 지난달 강원도 평창에서 제1회 'KBI컵 스키·스노보드 챔피언십' 대회를 개최했다. 겨울이면 매주 스키장을 찾을 정도로 오랜 '스키 애호가'인 그는 비인기종목인 설상 스포츠 발전과 선수 후원을 위해 나섰노라고 했다. 스키가 얼마나 좋은 운동인지 자랑할 때 박 회장 표정은 소년(少年)처럼 즐거워보였다. 서울역 인근 KBI그룹 본사에서 박 회장을 만나 얘기를 들어봤다.

박효상 KBI그룹 회장은 대구 섬유산업 상징인 '갑을'에서 분리돼 서울로 거점을 옮긴 '갑을상사그룹'을 현재 20여개 계열사를 거느린 글로벌 기업체로 일궈냈다. 이무성 객원기자


- (사)대한설상경기연맹 회장을 맡으신 계기는?

▶겨울에 할 수 있는 스포츠가 많지 않은데, 스키·스노보드 경우는 겨울에 즐기기 대단히 좋은 운동입니다. 저도 20대부터 스키를 타기 시작했는데, 10여년전부터는 경기에도 직접 나갈 정도로 좋아합니다. 하지만, 이런 종목들이 메달을 잘 따지 못한다는 이유로 국내에서 비인기종목으로 머물고 활성화되지 못하는 모습이 평소 매우 아쉬웠습니다. 우리 선수들이 뛸 수 있는 무대를 제공해서 설상 경기 종목 대중화에 기여하고, 선수들에게 경제적인 보탬도 되고 싶다는 생각에 상금도 걸고 올해 첫 대회를 열게 됐습니다. 첫 대회인데도 많은 호응이 있었습니다. 이를 계기로 스키협회 등에서 설상 종목 활성화에 관심을 가져주셨으면 하는 바람입니다.

- 겨울 스키 운동의 매력은?

▶주로 12월부터 3월까지 거의 매 주말 스키장을 갑니다. 1박2일도 좋고 여유가 되면 며칠씩 다녀올 때도 있습니다. 가면 거의 하루 종일 스키를 탑니다. 제가 20대 무렵부터 스키를 타기 시작했는데, 10여년 전부터는 경기에도 직접 출전할 만큼 스키는 매력적인 스포츠입니다. 스키는 폐활량을 키우는데 좋을 뿐 아니라 전신 근육 운동에 유리합니다. 특히 다리 근육량이 늘어나서인지 골프 운동 때 비거리도 늘어났어요. 심신을 개운하게 하는 데는 더 할 나위없죠. 스키, 스노보드 경기 종목에 2명이 경쟁하는 '듀얼', 4명이 시합하는 '크로스'라는 종목이 있는데, 혼자 즐길 때와는 비교도 안 될 정도의 짜릿함과 상쾌함이 있습니다.

- '갑을상사그룹' 초기는 어땠나요?

▶아버님이 대구상공회의소 회장을 역임하시고 얼마 안 되서 1991년 돌아가셨습니다. 예순살 때셨어요. 갑을상사그룹으로 계열 분리해 나온 게 1987년이었으니까 분가하고 얼마되지 않아서였죠. 저희 형제는 먼저 서울에 올라와 있었고 아버님은 대구에서 신사업을 찾고 계셨습니다. 성서공단에 작은 방직공장도 있었고요. 아버님 작고 후에 회사를 키우는데는 형님(박유상 고문)이 가장 역할을 많이 했죠. 서울로 진출해서 새로 시작하는 게 크게 어렵지는 않았습니다.

하지만, 섬유업종에서 탈피하는게 어려웠어요. 집 안 어른들도 섬유에서 빠져나가는데 대해 굉장히 부정적이셨어요. 하지만 당시 중국산 제품들이 밀려들었기 때문에 합성 섬유 업계 전망은 어두웠습니다. 그래서 '탈(脫) 섬유'를 모토로 자동자 부품과 철강, 환경, 의료 사업 등 신사업 쪽으로 계속 뻗어나갔습니다. 지금 생각하면 잘 빠져나왔다고 봅니다. 섬유업 명맥을 간직한다는 뜻에서 대구에 원사 유통업체를 두고 있으며, 매출은 전체 그룹의 3% 정도입니다.

박효상 KBI그룹 회장은 대구 섬유산업 상징인 '갑을'에서 분리돼 서울로 거점을 옮긴 '갑을상사그룹'을 현재 20여개 계열사를 거느린 글로벌 기업체로 일궈냈다. 이무성 객원기자


- KBI그룹 현황을 소개해 주신다면?

▶3대 경영 체제로 새로운 미래를 준비한다는 차원에서 그룹명을 갑을상사그룹에서 'KBI'(Korean Business Innovator)로 수년 전에 변경했습니다. '대한민국의 사업 혁신가'라는 그룹명 답게 끊임없이 도전하고 혁신하는 기업으로 발돋움하고자 합니다. 섬유 제조업으로 출발했지만, 90년대 들어 자동부 부품업에 진출했고, 이후 대구경 강관, 전선, 건설, 부동산, 환경, 에너지, 의료 등 다양한 분야로 사업을 확대해 나가고 있습니다. 유럽, 북미, 아시아, 중동 지역 10개국에 진출해 글로벌 기업으로 지속 발전하고 있습니다. (1987년 고 박재을 회장은 갑을상사그룹으로 분리 당시 동국실업, 갑을건설 등 9개사를 맡았으며, 현재 KBI그룹은 6대 사업 부문 20여개 계열사를 보유하고 있다.)

- 그룹 고속성장의 비결은?

▶해외 시장 개척입니다. 우리 회사 모토가 '해외로 해외로' 인데, 아직도 해외에는 우리가 개척할 수 있는 시장이 무궁무진합니다. 미국은 물론이고 유럽에도 우리 제품을 판매할 수 있는 수요처가 많습니다. 해외 시장은 한마디로 기회죠. 일례로 트럼프 대통령이 관세를 높였지만, 그 대신에 회사마다 할당된 쿼터(물량) 제한을 없앴습니다. 우리 회사 경우 할당된 철강 제품 수출량이 적었는데, 오히려 좋은 기회가 됐죠. 반면에 우리의 가장 큰 경쟁자인 중국은 미국의 견제 때문에 경쟁력을 잃어버렸어요. 미국의 중국 견제가 향후 10년은 갈 것 같는데, 이런 기회를 우리가 놓쳐서는 안됩니다. 국내에서 우리 기업끼리 경쟁하는 건 더이상 의미가 없어요.

- 역점을 두는 신사업 분야는?

▶친환경이 대세다 보니까 저희도 친환경적인 사업을 준비 중입니다. 배터리 제조 쪽에 투자를 하려니까 투자 규모가 너무 많아서 일단은 배터리 세이빙 쪽으로 관심을 두고 있습니다. 또 한전에 전기를 판매하는 용도로 해상 풍력 발전 사업도 진행 중인데, 수년 내로 가시적인 성과가 있을 것으로 기대하고 있습니다.

박효상 KBI그룹 회장은 대구 섬유산업 상징인 '갑을'에서 분리돼 서울로 거점을 옮긴 '갑을상사그룹'을 현재 20여개 계열사를 거느린 글로벌 기업체로 일궈냈다. 이무성 객원기자


- 고향인 대구에 전하고픈 메시지는?

▶현재 대구에 자동차부품 관련 대형 기업들이 꽤 있는 줄로 알긴 하지만, 과거에 섬유산업 메카로 누렸던 영광을 누렸던 생각을 하면 안타까운 면이 있습니다. 대구에 첨단 산업 분야 기업 유치가 활발히 이뤄져야 대구 경제가 살아날 수 있지 않을까 생각합니다. AI, 에너지, 의약품 같은 분야가 대구 쪽에 많이 유치되면 좋겠어요. 하지만, 도시마다 기업 유치를 위해 세금, 사업 부지 등을 좋은 조건에 경쟁적으로 제공하고 있습니다. 대구도 매력적인 요소를 적극 제시해서 기업 유치를 이루기를 바랍니다."
0004018908,네이버,한국전력,2025-03-14T09:09:00+09:00,"두산에너빌리티, 사우디서 8900억원 규모 가스복합발전소 계약","두산에너빌리티는 발주처인 사우디전력공사와 8900억원 규모의 PP12(Power Plant 12) 가스복합발전소 건설공사 계약을 체결했다고 14일 밝혔다. 발전소 건설 전문회사인 셉코3와 컨소시엄을 맺고 계약에 성공한 두산에너빌리티는 설계, 주요 기자재 공급, 종합 시운전을 담당한다.   
 
두산에너빌리티가 건설공사 계약을 체결한 PP12 가스복합발전소 위치. 두산에너빌리티 제공
 
PP12 가스복합발전소는 사우디아라비아의 수도 리야드에서 북서쪽으로 약 150km 떨어진 곳에 2028년 1800MW 규모로 준공될 예정이다. 사우디전력공사는 급증하는 사우디아라비아의 전력수요에 신속히 대응하기위해 이번 프로젝트를 추진하고 있다. PP12 가스복합발전소가 완공되면 사우디아라비아 전력망 안정에 기여할 것으로 보인다. 
 
두산에너빌리티 이현호 Plant EPC BG장은 “사우디아라비아는 향후 5년간 매년 6GW 규모의 발전소가 증설될 만큼 전력수요가 지속 증가하고 있다”며 “올해에만 카타르 피킹 유닛, 사우디 루마1, 나이리야1, PP12까지 중동에서 4건의 발전소 건설공사 계약을 체결하며 경쟁력을 입증한 만큼 시장을 더욱 확대해 나가겠다”고 말했다.
 
두산에너빌리티는 이번 프로젝트를 포함해 사우디아라비아에서 최근 5년간 약 6조 7000억원 규모의 프로젝트를 수주했다. 이달 12일 루마1, 나이리야1 가스복합발전소 계약을 체결했다. 이에 앞서 자푸라 열병합발전소 건설공사, 투와이크 주단조공장 건설공사, 얀부4 및 슈아이바3 해수담수화플랜트 건설공사 등을 수주한 바 있다."
0000429675,네이버,한국전력,2025-03-14T09:08:00+09:00,"두산에너빌, 8천900억 규모 사우디 가스복합발전소 계약체결","[두산에너빌리티 사우디아라비아 수주 발전소 위치 (두산에너빌리티 제공=연합뉴스)]

두산에너빌리티는 사우디전력공사와 8천900억원 규모의 PP12(Power Plant 12) 가스복합발전소 건설공사 계약을 체결했다고 오늘(14일) 밝혔습니다.

두산에너빌리티는 발전소 건설 전문회사인 셉코3와 컨소시엄을 맺어 계약을 따냈습니다. 설계, 주요 기자재 공급, 종합 시운전을 맡게 됩니다. 

PP12 가스복합발전소는 사우디아라비아 수도 리야드에서 북서쪽으로 약 150㎞ 떨어진 부지에 오는 2028년 1천800메가와트(㎿) 규모로 준공될 예정입니다.

이현호 두산에너빌리티 플랜트 EPC(설계·조달·시공) BG장은 ""사우디아라비아는 향후 5년간 매년 6기가와트(GW) 규모의 발전소가 증설될 만큼 전력수요가 지속 증가하고 있다""고 말했습니다.

이어 ""올해에만 카타르 피킹 유닛, 사우디 루마1, 나이리야1, PP12까지 중동에서 4건의 발전소 건설공사 계약을 체결하며 경쟁력을 입증한 만큼 시장을 더욱 확대해 나가겠다""고 덧붙였습니다.

두산에너빌리티는 이번 프로젝트를 포함해 사우디아라비아에서 최근 5년간 약 6조 7천억원 규모의 프로젝트를 수주했습니다.
 

당신의 제보가 뉴스로 만들어집니다.
SBS Biz는 여러분의 제보를 기다리고 있습니다.
홈페이지 = https://url.kr/9pghjn"
0008126844,네이버,한국전력,2025-03-13T06:15:00+09:00,4년 만에 흑자로 돌아섰지만…한전 올해도 법인세는 '찔끔',"개별재무제표 기준 지난해 영업이익 3조1666억원
이월결손처리로 3년간 누적손실 47조원 메워야
한국전력공사 나주 본사.(한전 제공, 재배포 및 DB 금지)/뉴스1


(나주=뉴스1) 박영래 기자 = 국내 최대 공기업 한국전력공사가 누적된 영업손실로 인해 올해 납부하는 법인세는 소액에 그칠 전망이다.

4년 만에 흑자로 돌아섰지만 최근 3년간 누적 영업손실이 눈덩이처럼 불어난 상황이라 이월결손 처리를 통해 이를 메워야 하기 때문이다.

납부한 법인세의 10%에 해당하는 법인지방소득세를 한전 지사 등이 소재한 지자체에 내야 하지만 이 역시 한푼도 내지 못할 것으로 보여 해당 지자체의 세수감소는 불가피해 보인다.

13일 금융감독원 전자공시시스템에 따르면 법인세 납부의 기준이 되는 개별재무제표 기준 한전의 2024년도 영업실적은 매출액 91조6465억 원, 영업이익 3조1666억 원이다.

한전이 벌어들인 총수익에서 영업비용과 기타 비용을 모두 제외하고 남은 법인세비용차감전 계속사업이익은 1조3억 원, 당기순이익은 8393억 원으로 집계됐다.

한전이 3년간의 적자를 딛고 4년 만에 흑자로 돌아섰지만 올해도 납부하는 법인세는 소액에 그칠 것으로 보인다.

국세인 법인세는 법인의 소득금액 등에 과세 표준대로 부과되는 세금이지만 한전은 2021년부터 2023년까지 3년 동안 무려 47조 원의 법인세비용차감전순손실을 기록 중이고 이를 지난해 벌어들인 수익에서 이월결손금으로 처리할 수 있다.

세법은 이 이월분 손실을 최대 15년까지 할 수 있도록 했다. 예를 들어 2021년 발생한 적자를 15년 안에 흑자를 낸 연도에서 매년 80%까지 공제해 세금을 절감할 수 있도록 해준다.

때문에 1조3억 원의 법인세비용차감전 계속사업이익 가운데 80%인 8000억 원은 공제받고 나머지 2000억 원을 대상으로 법인세를 산정해 부과하게 된다.

이 경우 21%의 법인세율을 적용받고 추가 공제 등을 진행해 납부할 법인세를 계산하게 된다.

한전 관계자는 ""세액공제 등이 남아 있어 올해 납부할 법인세가 정확히 얼마인지는 아직 확정되지 않았다""고 설명했다.

한전의 법인세 납부액이 소액에 그치면서 한전 지사가 자리한 전국의 여러 지자체도 세수결손이 불가피하다.

법인지방소득세는 법인의 전년도 귀속 소득에 과세해 매년 4월30일까지 사업장 소재지 관할 지자체가 걷는 세금이다.

한전은 법인세의 10% 정도에 해당하는 법인지방소득세를 나주시를 비롯한 해당 지자체에 납부해야하지만 올해도 사실상 0원에 그칠 것으로 예상된다.

2015년의 경우 한전은 서울 삼성동 부지 매각 등으로 많은 수익을 올리면서 1조 1500억 원의 법인세를 냈고, 당시 한전 지사 등이 소재한 전국 각 지자체에 법인지방소득세로만 1000억 원의 돈이 들어갔다.

한 지자체 관계자는 ""한전의 적자가 누적되면서 지자체 세수에도 어려움이 가중된 상황""이라고 말했다."
