식별 ID,수집한 플랫폼,수집한 종목,날짜,뉴스 제목,뉴스 내용
0005963969,네이버,한국전력,2025-03-17T11:02:00+09:00,"SGC에너지, 국회·환경부와 CCU 산업 발전 방향 논의","군산 사업장서 간담회 개최
[이데일리 김은경 기자] SGC에너지는 지난 14일 안호영 국회 환경노동위원장, 김완섭 환경부 장관과 탄소포집·활용(CCU) 사업에 대한 간담회를 진행했다고 17일 밝혔다.

간담회는 전북 군산 SGC에너지 사업장에서 진행됐다. 국회 환경노동위원회, 환경부, 한국환경공단 및 박준영 SGC에너지 부회장을 비롯한 주요 관계자 40여명이 참석했다.

참석자들은 이날 SGC에너지 친환경 발전소와 CCU 설비 현장을 탐방하고 CCU 사업 현황과 탄소중립 혁신 기술을 통한 온실가스 감축 성과를 확인했다.

특히 CCU 산업 활성화를 위한 제도 개선 방안을 논의하며 CCU 산업 발전과 온실가스 감축 목표를 달성하기 위한 적극적인 협력을 약속했다.

김완섭 환경부 장관은 “탄소 포집·활용·저장 기술과 같은 ‘기후테크’는 미래 탄소중립 실현의 핵심 열쇠”라며 “온실가스 감축기술에 설비투자, 규제개선, 연구개발(R&D), 금융지원 등을 국회와 협조해 다각적이고 종합적으로 추진할 것”이라고 말했다.

박준영 SGC에너지 부회장은 “CCU 사업을 비롯한 친환경 발전 사업으로 지속 가능한 미래 에너지 전환에 이바지하고 있다”며 “앞으로도 순환 경제 중심의 사업 역량을 지속적으로 강화해 나가며 국내 CCU 산업 발전과 탄소중립 실현에 앞장설 것”이라고 했다.

SGC에너지는 지난 2021년 한국전력공사로부터 이산화탄소 포집 기술을 이전받으며 본격적인 사업의 시작을 알렸다. 이후 자체 상용화 기술 개발을 완료해 2023년 11월 CCU 설비를 준공하고 지난해부터 CCU 상업 가동을 본격화했다. 하루 최대 300톤(t), 연간 10만t의 이산화탄소를 포집해 순도 99.9% 이상의 액화탄산을 생산하고 있다.

지난 14일 SGC에너지 군산 사업장에서 박준영 SGC에너지 부회장(오른쪽)과 안호영 국회 환경노동위원장(가운데), 김완섭 환경부 장관(왼쪽) 등 관계자가 CCU 설비를 살펴보고 있다.(사진=SGC에너지)"
0002443020,네이버,한국전력,2025-03-17T10:08:00+09:00,‘내달 적용’ 전기요금 동결 유력…7분기째 동결,"서울 중구 명동 한국전력공사 서울본부 입구 앞으로 시민들이 지나고 있다.［헤럴드경제DB］


한전 하루 이자 127억...재정 정상화 아직


[헤럴드경제=배문숙 기자]정부가 내달부터 적용되는 올해 2분기(4~6월) 전기요금을 동결할 것으로 전망된다.

17일 정부에 따르면 산업통상자원부는 이번주 한전으로부터 2분기 전기요금 인상여부를 결정할 자료를 보고 받는다. 이후 물가당국인 기획재정부와 논의를 거쳐 이달 말 요금을 최종 결정한다.

그러나 2분기 전기요금은 동결로 가닥을 잡은 것으로 전해진다. 전기요금은 기본요금, 전력량요금, 기후환경요금, 연료비 조정요금으로 구성된다. 이 중 연료비 조정요금은 직전 3개월간 유연탄, 액화천연가스(LNG) 등 연료비 변동 상황을 반영해 ±5원 범위에서 결정된다.

2분기 적용할 연료비 조정단가는 현재와 같은 ㎾h(킬로와트시)당‘+5원’으로 유지할 전망이다. 연료비 조정단가는 2022년 3분기 이후 11개 분기 연속 같은 수준을 이어가고 있다. 지난해 10월 산업용 전기요금만 평균 9.7% 올랐고, 일반용 전기요금은 7개 분기 연속 오르지 않고 있다.

전기요금은 윤석열 정부 들어 지난 2년 반 동안 7차례 올랐지만, 여전히 한전의 경영 정상화를 위해선 추가적인 인상이 필요하다는 지적이 나온다. 한전은 전기요금 인상 등에 힘입어 지난해 4년 만에 흑자 전환에 성공했지만 총부채는 전년보다 2조7310억원 증가한 205조1810억원으로 집계돼 역대 최대치를 기록했다. 한전은 작년 한 해도 5조원가량의 이자를 부담한 것으로 추산된다. 하루로 산정하면 127억원에 이른다.

한전의 심각한 재무 위기는 러시아·우크라이나 전쟁을 전후로 2021∼2023년 국제 에너지 가격이 급등했는데도 원가 밑으로 전기를 공급하면서 본격화했다. 한전은 2021∼2023년에만 43조원대의 누적 영업 적자를 냈다.

이로써 한전은 전력 판매로 번 돈 대부분을 이자 지급에 쓰는 상황이다. 대규모 부채를 줄이지 못해 만기가 도래하면 대부분 ‘돌려막기’를 하며 버티고 있다.

이런 한전의 열악한 재무 상황은 국가 전력 인프라의 핵심인 송배전망 구축 등 투자 집행에 영향을 줄 것이라는 우려가 꾸준히 제기되고 있다. 실제로 작년 한전의 투자비 집행 실적은 송배전망 건설비 5조4000억원을 포함, 총 16조8000억원으로 계획 대비 집행률이 91%에 그쳤다. 제10차 장기 송·변전 설비 계획상으로 2036년 우리나라의 총 송전선로 길이는 2021년의 약 1.64 배로 늘려야하는데, 여기에는 약 56조원이 들 것으로 예상되는 상황이다."
0005963820,네이버,한국전력,2025-03-17T09:40:00+09:00,"DL이앤씨, '220억 규모' 중부발전 인니 새 수력발전 건설","CM 맡아 2030년까지 설계·시공관리 총괄
중부발전 3번째 인니 수력발전…연내 착공
[이데일리 김형욱 기자] DL이앤씨(375500)가 발전 공기업 한국중부발전이 인도네시아에서 진행하는 시보르빠 수력발전소 건설을 맡는다.

김광일(왼쪽 2번째부터) 한국중부발전 기술안전본부장과 문병두 DL이앤씨 토목사업본부장 등 양사 관계자가 지난 14일 인도네시아 시보르빠 수력발전사업 기본설계 및 건설사업관리 용역 계약 후 기념촬영하고 있다. (사진=중부발전)
중부발전과 DL이앤씨는 지난 14일 1500만달러(약 220억원) 규모 인도네시아 시보르빠 수력발전사업 기본설계 및 건설사업관리 용역 계약을 했다고 17일 밝혔다.

중부발전이 인도네시아 수마트라섬 북동부 빌라강에 114메가와트(㎿) 규모 수력발전소를 짓고 이곳 발전 전력을 인도네시아전력공사에 판매하는 사업이다. 약 100만명이 쓸 수 있는 발전량이다.

중부발전은 이 사업을 추진하기 위해 싱가포르 법인 인니 시보르빠 수력(PT.Siborpa Eco Power)을 설립했으며 최근 사업 수주에 성공해 연내 착공키로 했다. 중부발전은 인도네시아에서 2개 화력발전(찌레본 1~2)과 2개 수력발전(땅가무스·왐푸)를 운영하는 등 이미 활발한 발전사업을 펼치고 있다. 수력발전 기준으로 이번이 세 번째 현지 사업이다. 특히 이번 사업 규모는 기존 왐푸(45㎿), 땅가무스(55㎿) 2곳을 합친 것보다 더 큰 규모다.

DL이앤씨는 이곳 건설사업관리자(CM)로서 2030년 8월까지 이곳 설계와 시공 등을 총괄하게 된다. 단순한 건설 도급을 넘어 현지 협력 건설사 관리·감독을 포함한 프로젝트 전반을 총괄하는 역할이다.

DL이앤씨는 1990년대 수력발전소 건설 분야에 뛰어들어 국내기업 기준 최다 시공 실적을 갖고 있다. 지난 2022년 인도네시아의 첫 양수발전소인 어퍼 치소칸 수력발전소를 착공하는 등 현지 경험도 있다. 이곳 관계자는 “해외 수력발전 공사로 축적한 기술력이 이번 수주로 이어졌다”고 전했다.

공기업인 중부발전이 해외 발전사업 역량을 토대로 추가 발전사업을 따내고 국내 민간 건설사가 CM을 맡아 건설을 추진한다는 점에서 민·관 상생협력의 좋은 사례가 될 것으로 기대된다. 중부발전은 완공 이후 이곳 발전 전력을 인도네시아전력공사에 판매해 수익을 내게 된다.

김광일 중부발전 기술안전본부장은 “해외 시장에서 민·관 동반성장의 새로운 모델을 제시하게 돼 기쁘다”며 “대한민국의 우수 기술력을 해외 시장에 확산하고 인도네시아의 신·재생에너지 정착을 지원하는 주요 이정표가 될 것”이라고 말했다."
0002192705,네이버,한국전력,2025-03-17T09:00:00+09:00,"[소부장탐방] 신성이엔지, '클린룸 핵심' 용인 사업장…반도체 혹한기에 빛난 스마트화","신성이엔지 용인 스마트팩토리 [ⓒ신성이엔지]


[디지털데일리 고성현 기자] 최근 방문한 신성이엔지의 용인 스마트팩토리. 반도체 제조 환경의 외부 오염 요소를 차단하기 위한 핵심 설비가 만들어지고 있는 현장이다. 얼어붙은 반도체 업계의 투자로 '슈퍼사이클' 당시 활기보다는 조용한 분위기였지만, 움츠린 다리를 펼 준비를 하듯 팬필터유닛(FFU)이 차곡차곡 쌓이고 있었다. 현장에서는 실시간으로 찍혀나오는 FFU의 개수를 보며 ""언제라도 생산을 다시 확대할 수 있도록 준비하고 있다""며 희망적인 목소리를 냈다.

용인 스마트팩토리는 2016년 신성이엔지가 준공한 스마트공장이다. 지난 1991년 신성이엔지가 처음 국산화한 FFU, 장비용 FFU(EFU) 등을 생산하고 있다. 신성이엔지는 이 부품을 장비사 등에 납품하거나 반도체 제조사 공장에 직접 시공하고 있으며, 삼성전자·SK하이닉스를 비롯한 전세계 반도체·디스플레이 업체들을 고객사로 두고 있다.

클린룸은 제조 환경에 존재하는 미세먼지(Particle)를 제거하고 온·습도를 정밀하게 제어하는 공간이다. 수십 나노미터(㎚)대 회로 선폭 구성으로 작은 먼지에도 큰 영향을 받는 반도체 웨이퍼를 가장 앞 단에서 지킨다. FFU는 클린룸 구성 중 파티클을 제거하면서도 내부 공기를 순환시키는 핵심적인 역할을 한다.

용인 스마트팩토리가 건설된지 어느덧 9년여가 지났지만, 국내에서는 중소·중견 기업 중 용인과 같은 레벨3급의 스마트 공장은 여전히 드물다. 일부 부분 요소를 디지털화해 관리하거나 전체 공정을 데이터화한 업체는 있지만, 이를 실시간으로 분석해 품질을 개선하거나 예지 보전하는 시스템이 구축되지는 않았다는 의미다. 이같은 성과에 따라 용인 사업장은 2021년 중소벤처기업부로부터 'K-스마트등대공장'으로 선정됐다.

신성이엔지 용인 스마트팩토리 [ⓒ신성이엔지]


이날 만난 조현성 신성이엔지 용인사업장 공장장(이사)은 ""용인 사업장은 FFU 생산라인 기준으로 80% 이상이 자동화가 돼 있으며, 현재 타 라인으로의 확대 적용을 위해 투자 계획을 수립하고 시점을 보고 있다""며 ""스마트화에 따라 현재 생산 수준이 2016년 대비 210%까지 상승했다. 공정 불량률은 95% 감축한 수준""이라고 밝혔다.

조 이사는 ""현재 생산관리시스템(MES)이 도입돼 불량이나 이슈를 실시간으로 파악해 원인을 찾을 수 있으며, 이같은 방식이 다품종 소량생산에 대응할 수 있다는 것이 강점""이라며 ""특히 인공지능(AI)을 도입해 (생산품 변화에 따라) 설비 변화에 대한 시간적 비용을 줄일 수 있고, 단순 반복 작업도 해결할 수 있다""고 말했다.

MES는 현장 설비 상태와 생산 실적을 모니터링하고 품질데이터를 분석해 불량을 관리하는 시스템이다. 사후적으로 결과가 도출되는 전사적 자원관리 시스템(ERP)과 달리 실시간으로 현황을 파악해, 제조 중 일어난 불량 문제나 생산성 등을 단기간에 개선할 수 있다는 것이 강점이다. 신성이엔지는 지난 2019년부터 MES를 도입해 용인 사업장의 고도화 작업에 나선 바 있다.

조 이사는 MES의 강점을 두고 생산에 대한 유연성을 조절할 수 있는 점도 강점으로 꼽았다. 그는 ""통상 이러한 제품 제조는 작업자 숙련도나 작업 속도에 따라 좌우되는 경향이 짙으나 이를 통해 최대·최소 생산량에 대한 범위를 파악할 수 있게 됐다""고 전했다. 이는 고객사 수주의 핵심 경쟁력인 납기 대응력을 높이는 것은 물론, 불필요한 비용을 줄여 위기 관리를 할 수 있다는 측면에서 의의가 있다.

자동화된 FFU 생산라인의 모습도 인상적이다. FFU가 만들어지는 초반부부터 고객사에 출하되는 끝단까지 제조용 관절로봇 등이 활용되고 있어서다. 관절로봇이 FFU의 제조부터 덮개를 씌우는 조립, 포장 작업까지 투입돼 작업하고 라인 곳곳에 장착된 머신 비전이 검사해 정밀도를 높이는 식이다. 이후 작업자들이 참여하는 검사 라인에서 양품 확인이 끝나면, 자율주행로봇(AMR)에 차곡차곡 쌓여 출하된다.

신성이엔지가 제조하는 팬필터유닛. 주로 클린룸 천장에 부착돼 내외부 공기를 순환하는 역할을 한다.[ⓒ신성이엔지]


아울러 공장은 제조에 필요한 전력 운용 방식도 효율화됐다. 태양광·에너지저장장치(ESS)로 구성된 마이크로그리드 시스템이 공장을 뒷받침 중이다. 공장 부지 중앙에 설치된 태양광 시스템이 대낮동안 전력을 생산하고, 이를 ESS가 충·방전해 전력을 충당하고 있다. 주로 새벽, 오전께 충전한 전력이 생산이 활발해지는 대낮이나 오후쯤 활용되는 식으로 이뤄진다. 나머지 전력은 한국전력 등에 판매된다.

용인 스마트팩토리는 창업주인 이완근 회장을 비롯한 신성이엔지 주요 경영진의 의지이자 성과로도 꼽힌다. 4차 산업 혁명으로의 전환과 함께 고령화·저출산 등이 미칠 영향을 미리 내다본 것이다. 인구 감소와 제조업에 대한 지속적인 기피를 고려해 선제적으로 스마트 공장을 도입, 장기적으로도 살아남겠다는 뜻이 담겨 있다.

이같은 의지는 반도체 시장이 침체된 작년에도 보탬이 됐다. 반도체 불황에 따른 설비투자 중단, 납기 이연 등의 위기에 유연하게 대응할 수 있는 여력을 갖춘 것이다. 특히 스마트팩토리에 쏟으며 확보한 노하우들은 솔루션·시스템 구축 업체인 신성이넥스 사업의 고도화, 태양광 및 설계·조달·시공(EPC) 사업 확대로 이어지고 있다.

신성이엔지의 다음 스텝은 반도체 시황 개선과 함께 찾아올 용인 반도체 클러스터다. 높은 생산 유연성을 통해 다가올 대규모 수주를 맞이하는 한편, 인근 지역이라는 이점을 적극 활용해 납기에 대응하겠다는 목표다. 조 이사는 ""내년 하반기 정도부터 관련 대응이 본격화될 것으로 본다. 지리적 이점을 활용할 생각을 하고 있다""며 ""입주를 희망하거나 참여하는 기업을 통해 근접 지원할 수 있다고 본다""고 운을 뗐다.

조 이사는 ""최근에는 생산 물량이 반도체 사이클에 따라 변동 폭이 큰 추세다. 과거에 비해 사이클 주기도 변동이 심한 상황""이라며 ""현재 3년째 이어지는 침체기가 언제 풀릴지도 모르는 만큼, 이에 대응할 수 있는 유연한 환경을 갖추는 게 가장 큰 목표""라고 말했다."
0005561700,네이버,한국전력,2025-03-17T07:59:00+09:00,'월 40억 버는 효자' 거대 태양광 패널…'햇볕 쨍쨍' 호남서 찾은 'AI 데이터센터 해뜰날'[AI 시대 電力이 국력]⑩,"일조량 풍부해 타지역보다 효율↑
발전 시간 평균 4시간 이상
드넓은 간척지 및 호수 등 잠재력↑
친환경 AI 집적단지 유치에 '유리'
지난달 24일 방문한 전남 해남군 솔라시도 재생산업단지. 전남 최대 규모의 태양광 산업단지인 이곳에는 성인 남성 두 명은 족히 누워있을 수 있는 크기의 태양광 패널이 25만장이 깔려 있다. 45만평 안팎의 넓이로 서울 여의도 면적의 절반가량이다. 주변을 한 바퀴 둘러보는 데만 1시간30분가량 걸린다.

전남 해남군 솔라시도를 상공에서 촬영한 모습. 사진 상 위에서 아래 방향으로 흐르는 강줄기를 기준으로 왼쪽이 솔라시도 신재생에너지 운영센터, 오른쪽이 'AI 슈퍼클러스터 허브'가 조성될 120만평에 달하는 부지다. 심성아 기자


태양광 패널 사이를 가로질러 안으로 더 들어가자 솔라시도 신재생에너지 운영센터가 나왔다. 운영센터에는 태양광의 실시간 전력 현황과 전체 발전 시간, 전체 이산화탄소 저감량, 에너지저장장치(ESS) 상태 등을 한눈에 확인할 수 있는 모니터가 설치돼 있었다.

이날 오후 해남의 하늘에 구름이 꽤 낀 상태였다. 그럼에도 태양광 출력은 90㎿를 웃도는 수치가 표시됐다. 솔라시도 태양광 발전소의 올해 누적 발전량은 18.243GWh에 달했다. 문옥식 솔라시도태양광발전 대표는 ""이곳은 모니터링 시스템을 이용해 대량의 패널과 ESS를 체계적으로 관리할 수 있고, 문제가 발생하면 즉각 대응할 수 있다""고 설명했다.

이곳에서는 발전량이 많은 낮에 생산한 전기를 우선 ESS에 저장한 뒤 전력 소비가 많은 오후 4시 이후에 변전소를 통해 한국전력에 보낸다. 문 대표는 “하루 발전량은 평균 360㎿h다. 금액으로 환산했을 때 하루 1억3000만원, 월 40억원의 매출을 올리고 있다. 오늘처럼 발전량이 양호한 날엔 400~500㎿h까지 전기를 생산할 수 있다”고 말했다.

일조량이 풍부한 지역 특성 덕에 다른 지역보다 발전 시간도 남다르다. 전국 평균은 3.6시간이지만 솔라시도는 4시간이 훌쩍 넘어간다. 현재 전남도 전체 재생에너지 발전 시설 설비 용량은 6GW다. 실제 발전 용량은 1GW급 원자력 1기 규모 이상이다. 전남도 관계자는 ""재생에너지의 간헐성 때문에 원자력발전소 1기의 발전을 하려면 6GW의 태양광 설비가 필요한데 전남은 일조량이 많아 4~5GW면 충분하다""고 말했다.

지난달 24일 방문한 전남 해남군 솔라시도 재생산업단지 모습. 성인 남성 키를 훌쩍 넘는 높이의 거대한 태양광 패널이 25만장 깔려 있다. 심성아 기자


전남도는 이렇게 풍부한 재생에너지를 이용해 인공지능(AI) 데이터센터 유치에 적극적으로 나서고 있다. 전남에서 생산한 전기의 절반은 도내에서 사용하고 나머지는 수도권으로 보낸다. 전남엔 넓은 간척지와 호수 등 태양광 발전을 추가로 설치할 수 있는 공간이 풍부하다. 이런 부분까지 모두 활용하면 재생에너지를 활용한 데이터센터 유치에 대한 잠재력이 뛰어나다는 것이 도의 입장이다.

전남의 재생에너지 데이터센터 건립 계획은 이미 구체화하고 있다. 솔라시도 산업단지에서 차량으로 10분쯤 이동하니 가늠이 안 될 정도로 광활한 대지가 눈앞에 펼쳐졌다. 전남도는 120만평에 달하는 이 부지에 2030년까지 총 15조원을 투자해 세계 최대 규모인 3GW 이상의 'AI 슈퍼클러스터 허브'를 조성할 계획이다. 이곳에는 AI 컴퓨팅 인프라를 비롯해 데이터센터, 대규모 ESS 등이 구축될 예정이다.

전남도는 미국 투자기업 스톡팜로드(SFR)와 관내에 3GW급 규모의 초대형 데이터센터 유치를 위한 양해각서를 체결했다. 도에 따르면 SFR은 최대 15조원을 투자하고, AI 슈퍼클러스터 허브는 2028년 준공할 예정이다. 해당 시설이 구축되면 세계 최대 규모의 데이터센터가 될 전망이다.

도 관계자는 ""평평한 땅과 재생에너지를 통한 전력공급, 원활한 공업용수 수급 등 세 박자가 맞는 곳이 전 세계에 거의 없다""며 ""전남도에서 1년간 생산하는 전력량의 절반 정도만 사용해도 충분하고 도의 잠재적인 발전량은 훨씬 많기 때문에 이러한 조건이 긍정적으로 작용한 것 같다""고 했다.



데이터센터 유치에 필수적인 전기, 공업용수 등 인프라 구축도 진행 중이다. 전남도는 한전과 업무협약을 맺어 데이터센터 부지 바로 옆에 2028년까지 500㎿급 변전소를 설치하기로 했다. 이 변전소는 솔라시도 등 인근 태양광 발전소에서 생산한 전기를 끌어오게 된다. 공업용수는 근처 영암호의 물을 이용할 계획이다.

도 관계자는 ""풍부한 일조량 등 솔라시도의 자연환경을 토대로 태양광, 풍력 등 대규모 친환경 재생에너지 발전단지를 조성하고, 여기에서 생산된 재생에너지를 인근 데이터센터와 산업벨트에 공급함으로써 탄소중립을 실현한다는 계획""이라고 설명했다.

지난달 24일 방문한 전남 해남군 솔라시도의 'AI 슈퍼클러스터 허브'가 조성될 120만평 부지. 'RE100 예정부지'라고 적힌 간판이 설치돼 있다. 전남도는 이곳에서 재생에너지로 발전한 전력을 데이터센터에 이용할 방침이다. 심성아 기자


재생에너지를 이용해 데이터센터를 구축하려는 시도는 전남도뿐만이 아니다. 전국 지방자치단체들이 앞다퉈 관련 투자 유치와 대규모 사업 계획을 추진하고 있다. 탄소 중립을 실현하기 위해 친환경 에너지 기반을 데이터센터를 구축하려는 글로벌 IT 기업들이 주요 타깃 고객층이다.

광주시는 인근 전남의 풍부한 태양광 발전과 연료전지를 이용해 첨단 3지구에 친환경 AI 집적단지를 구축하고 있다. 광주시는 국내 최초로 엔비디아의 그래픽처리장치(GPU) H100 880개를 확보했다. 현재까지 총 263개의 AI 기업 유치를 위한 업무협약(MOU)을 체결했으며 AI 사관학교 및 AI 영재고 등 전문 교육기관까지 갖출 예정이다.

NHN이 광주에서 운영 중인 AI 데이터센터는 수완변전소와 첨단변전소에서 각각 6㎿의 전기를 공급받고 있다. 광주시 관계자는 ""태양광 발전 설비와 연료전지 설비를 구축해 첨단 3지구를 에너지 자립 산단으로 조성할 계획""이라고 말했다. 광주시는 지난해 발전사업 허가를 취득했으며 올해 일반수소입찰 시장에 참가한 후 1단계 연료전지 발전 사업 착공에 들어갈 계획이다.

광주시는 1단계 사업으로 2027년까지 1193억원을 투입해 18.84㎿ 연료전지를 설치하기로 했다. 연간 142.4GWh 전력 생산이 예상되며 이는 4만8000여가구가 사용할 수 있는 전기다. 기존 화력발전 대비 30% 탄소 배출 감축 효과가 예상된다."
