식별 ID,수집한 플랫폼,수집한 종목,날짜,뉴스 제목,뉴스 내용
0001063558,네이버,한국전력,2025-03-13T10:08:00+09:00,"두산에너빌리티, 2.2조원 사우디 가스복합발전소 계약 체결","두산에너빌리티가 건설공사 계약을 체결한 사우디아라비아 루마1, 나이리야1 가스복합발전소 위치. /사진=두산에너빌리티
두산에너빌리티가 2조2000억원 규모의 사우디아라비아 가스복합발전소 공사계약을 맺었다.

두산에너빌리티는 프로젝트 디벨로퍼(개발사업자)인 한국전력공사 컨소시엄과 '사우디 루마1, 나이리야1 가스복합발전소' 건설공사 계약을 체결했다고 13일 밝혔다. 두산에너빌리티는 발전소 건설 전문회사인 셉코3와 컨소시엄으로 설계부터 기자재 공급·설치·시운전에 이르는 전 공정을 일괄 수행하는 EPC 방식을 통해 2028년까지 준공할 예정이다.

루마1과 나이리야1은 사우디 전력조달청(SPPC)이 국제입찰로 발주한 프로젝트다. 각각 리야드 북동쪽 80km와 470km 떨어진 곳에 1800MW급 가스복합발전소를 1기씩 건설해, 향후 25년간 생산된 전력을 SPPC에 판매하는 사업이다. 한전 컨소시엄은 지난해 11월 SPPC와 전력판매계약(PPA)을 체결한 바 있다.

이현호 두산에너빌리티 Plant EPC BG장은 ""이번 계약은 중동 지역의 에너지 수요 증가와 맞물려 두산에너빌리티의 건설 수행 기술과 경쟁력을 국제 무대에서 다시 한번 입증한 사례""라며 ""사우디아라비아 내 안정적인 전력 공급을 위해 최선을 다하겠다""고 말했다."
0001201678,네이버,한국전력,2025-03-13T10:05:00+09:00,"두산에너빌리티, 2.2조 가스발전소 공사 수주","두산에너빌리티가 2조 2000억원 규모의 사우디아라비아 가스복합발전소 공사를 따냈다.

두산에너빌리티는 프로젝트 디벨로퍼(개발사업자) 한국전력공사 컨소시엄과 '사우디 루마1·나이리야1 가스복합발전소' 건설 공사 계약을 체결했다고 13일 밝혔다.

컨소시엄은 한전과 사우디전력공사(SEC), 사우디 최대 민자발전사인 ACWA Power로 구성됐다.

두산에너빌리티는 발전소 건설 전문회사인 셉코3(SEPCO-3)와 컨소시엄을 구성해 2028년까지 가스복합발전소를 준공한다.

설계에서부터 기자재 공급, 설치, 시운전에 이르기까지 전 공정을 일괄 수행하는 EPC 방식이다.

사우디 전력조달청(SPPC)이 국제입찰로 발주한 이 프로젝트는 1,800MW급 가스복합발전소를 건설하는 사업이다.

리야드 북동쪽 80km와 470km 떨어진 곳에 각 1기씩 짓는다. 향후 25년 간 생산된 전력을 SPPC에 판매하는 구조다.

한전 컨소시엄은 지난해 11월 SPPC와 전력판매계약(PPA)을 체결했다.

이현호 두산에너빌리티 Plant EPC BG장은 ""두산에너빌리티의 건설 수행 기술과 경쟁력을 국제 무대에서 다시 한번 입증한 사례""라고 말했다.

최근 사우디아라비아의 전력 수요는 꾸준히 증가하고 있다.

시장조사기관 모르도르 인텔리전스에 따르면 사우디아라비아 전력 설비 규모는 2025년 92.9GW에서 2030년 123.2GW로 연평균 6GW 성장할 전망이다."
0002366478,네이버,한국전력,2025-03-13T10:01:00+09:00,내 의료·통신데이터 전송 오늘부터 가능···'마이데이터' 시행,"개인정보위, 파급 효과 큰 두 분야서 시작 점차 확대...지원 플랫폼도 상반기 오픈
#(의료) A씨는 만성질환 위험도 분석 및 맞춤형 질환 관리 서비스를 제공하는 마이데이터 사업자에게 상급종합병원이 보유하고 있는 본인의 진단정보를 전송하게 했다. 이에, 만성질환 가능성을 예측하고 효과적으로 예방관리가 가능하게 됐다.

# (통신) B씨는 실제 통신 이용량 패턴에 기반한 이용자 맞춤 최적 요금제 추천 서비스를 제공하는 마이데이터 사업자에게 이동통신사가 보유하고 있는 본인의 통신 이용정보, 청구정보 등을 전송, 통신요금을 절약했다.

# (에너지) C씨는 에너지 소비패턴 분석을 통한 누진제 진입 알람 및 사용량 관리 서비스를 제공하는 마이데이터 사업자에게 한국전력공사가 보유하고 있는 전기 소비량 정보 등을 전송하게 함으로써, 전기 사용량을 효과적으로 관리하는 한편 전기요금도 절약하게 됐다.


국민 누구나 본인 정보를 의료, 통신, 에너지 등 원하는 곳에 쓰이도록 해 삶을 보다 윤택하게 할 수 있는 ‘마이데이터’ 사업이 본격 추진된다. 지난 2023년 3월 개인정보 보호법 개정 시 도입된 전 분야의 마이데이터(개인정보 전송요구권) 조항이 그간의 경과기간을 거쳐 3월 13일자로 시행된다. 이전에는 개별 법률에 의해 금융, 공공 분야에서 제한적으로 마이데이터 제도가 시행되고 있었지만, 이제는 전 분야에 적용이 가능한 계기가 마련된 것이다.

마이데이터 주무부처인 개인정보보호위원회(위원장 고학수, 개인정보위)에 따르면, 제도 초기에는 파급효과가 큰 의료, 통신 분야부터 우선 시행하고 내년 6월에는 에너지 분야가 추가된다. 개인정보위는 마이데이터 우선 도입 대상으로 국민 생활과 밀접한 10대 중점분야(의료, 통신, 에너지, 교통, 교육, 고용, 부동산, 복지, 유통, 여가)를 선정하고, 의료·통신·에너지 외에 나머지 중점분야에 대해서도 단계적으로 확대를 추진할 방침이다.


마이데이터 제도는 정보주체가 본인 개인정보를 개인정보 보유 사업자 등으로부터 직접 전송(‘본인전송요구’)받을 수도 있고, 맞춤형 서비스를 제공하는 마이데이터 사업자 등 제3자에게 전송(‘제3자전송요구’)하도록 할 수도 있다.

그간 정보주체는 기업‧기관 등이 제공하는 서비스 이용을 위해 개인정보 활용에 동의하면 그 이후로는 데이터 활용‧관리에 적극적인 권리를 행사하기 어려웠다. 기업·기관 입장에서도 많은 데이터가 기업‧기관별 칸막이에 가로막혀 있어 데이터 유통 생태계 활성화에 한계가 있었다.

전 분야 마이데이터가 시행되면 정보주체는 자신의 통제 하에 본인의 개인정보를 관리하고, 본인이 원하는 서비스에 활용할 수 있게 된다. 또 분야 간 데이터 융합이 활성화, 데이터 경제 체질도 한 단계 혁신될 것으로 기대된다.

개인정보위는 상반기 중에 정보주체의 마이데이터 관련한 권리 행사를 지원하기 위해 ‘범정부 마이데이터 지원 플랫폼(가칭)’을 오픈할 예정이다. 플랫폼이 오픈되면 본인전송요구가 가능한 개인정보 보유 사업자 등(정보전송자)과 마이데이터 사업자 현황을 확인할 수 있는 것은 물론, 그동안의 전송요구 내역 확인, 전송요구 철회 등도 가능해질 전망이다.

고학수 개인정보위 위원장은 “전 분야 마이데이터 시행을 통해 국민이 진정한 데이터의 주인이 될 수 있을 것”이라며 “다양한 분야의 의견을 수렴해 향후 국민이 체감할 수 있고 파급력이 큰 분야부터 점진적으로 확대해 나갈 계획”이라고 밝혔다.

개인정보위는 이달 내로 제도 안내서(초안)를 개인정보위 홈페이지에 공개하는 한편, 국민·관련 기업을 대상으로 오는 18일 오후 3시 한국광고문화회관에서 제도 설명회를 개최할 계획이다.

참가 사전 등록은 'https://m.site.naver.com/1DAQ1'로 하면 된다."
0002465671,네이버,한국전력,2025-03-13T09:51:00+09:00,"두산에너빌리티, 사우디 가스복합발전소 계약 참여","사우디 발전설비 2030년까지 총 123.2GW 규모로 연평균 6GW 증설 전망
▲  두산에너빌리티가 건설공사 계약을 체결한 사우디아라비아 루마1, 나이리야1 가스복합발전소 위치
ⓒ 두산에너빌리티

경남 창원에 본사를 두고 있는 두산에너빌리티가 2조 2000억원 규모의 사우디아라비아 가스복합발전소 공사계약을 체결했다.

이 회사는 프로젝트 디벨로퍼(개발사업자)인 한국전력공사 컨소시엄과 '사우디 루마1, 나이리야1 가스복합발전소' 건설공사 계약을 체결했다고 13일 밝혔다.

두산에너빌리티는 발전소 건설 전문회사인 셉코3(SEPCO-3)와 컨소시엄으로 설계에서부터 기자재 공급, 설치, 시운전에 이르기까지 전 공정을 일괄 수행하는 방식으로 2028년까지 준공할 예정이다. 프로젝트의 설계, 자재조달, 건설을 포괄하는 계약(EPC)이다.

이 회사는 ""사우디 전력조달청이 국제입찰로 발주한 루마1과 나이리야1 프로젝트는, 각각 리야드 북동쪽 80km와 470km 떨어진 곳에 1800MW급 가스복합발전소를 1기씩 건설해, 향후 25년간 생산된 전력을 SPPC에 판매하는 사업이다""라고 설명했다.

한전 컨소시엄은 지난 해 11월 SPPC와 전력판매계약(PPA)을 체결했다.

이현호 두산에너빌리티 BG장은 ""이번 계약은 중동 지역의 에너지 수요 증가와 맞물려 두산에너빌리티의 건설 수행 기술과 경쟁력을 국제 무대에서 다시 한번 입증한 사례""라며 ""사우디아라비아 내 안정적인 전력 공급을 위해 최선을 다 하겠다""고 말했다."
0000915656,네이버,한국전력,2025-03-13T09:51:00+09:00,"두산에너빌, 사우디서 2조2000억원 규모 가스복합발전소 계약","한전 컨소시엄과 EPC 계약⋯루마1·나이리야1 총 3600MW 규모
두산에너빌리티가 2조2000억원 규모의 사우디아라비아 가스복합발전소 건설 공사를 수주했다.

두산에너빌리티가 건설공사 계약을 체결한 사우디아라비아 루마1, 나이리야1 가스복합발전소 위치. [사진=두산에너빌리티]


두산에너빌리티는 프로젝트 디벨로퍼(개발사업자)인 한국전력공사 컨소시엄과 '사우디 루마1, 나이리야1 가스복합발전소' 건설공사 계약을 체결했다고 13일 밝혔다. 

한전 컨소시엄은 한전과 사우디 전력공사(SEC), 사우디 최대 민자 발전사로 구성됐다.

두산에너빌리티는 발전소 건설 전문회사인 셉코3(SEPCO-3)와 컨소시엄으로 설계에서부터 기자재 공급, 설치, 시운전에 이르기까지 전 공정을 일괄 수행하는 EPC 방식으로 2028년까지 준공할 예정이다.

사우디 전력조달청(SPPC)이 국제입찰로 발주한 루마1과 나이리야1 프로젝트는 각각 리야드 북동쪽 80km와 470km 떨어진 곳에 1800메가와트(MW)급 가스복합발전소를 1기씩 건설해 향후 25년간 생산된 전력을 SPPC에 판매하는 사업이다. 

한전 컨소시엄은 지난해 11월 SPPC와 전력판매계약(PPA)을 체결했다.

두산에너빌리티 이현호 플랜트 EPC BG장은 ""이번 계약은 중동 지역의 에너지 수요 증가와 맞물려 두산에너빌리티의 건설 수행 기술과 경쟁력을 국제 무대에서 다시 한번 입증한 사례""라며 ""사우디아라비아 내 안정적인 전력 공급을 위해 최선을 다 하겠다""고 말했다.

최근 사우디아라비아의 전력 수요는 꾸준히 증가하고 있다. 

시장조사기관 모르도르 인텔리전스에 따르면 사우디아라비아 전력설비 규모가 2025년 92.9기가와트(GW)에서 2030년 123.2GW로 연평균 6GW 규모의 발전소가 증설될 전망이다."
0003419497,네이버,한국전력,2025-03-13T09:49:00+09:00,"두산에너빌리티, 사우디 2.2조 규모 가스복합발전소 계약 체결","사우디아라비아 루마1과 나이리야1 프로젝트 1기씩 건설
사우디아라비아 루마1과 나이리야1 발전소 위치. 두산에너빌리티 제공


두산에너빌리티가 사우디아라비아에서 2조2000억원 규모의 가스복합발전소 공사계약을 체결했다.

두산에너빌리티는 13일 프로젝트 디벨로퍼(개발사업자)인 한국전력공사 컨소시엄과 '사우디 루마1, 나이리야1 가스복합발전소' 건설공사 계약을 체결했다고 밝혔다. 한전 컨소시엄은 한전과 사우디 전력공사(SEC), 사우디 최대 민자 발전사로 구성됐다.

두산에너빌리티는 발전소 건설 전문회사인 셉코3와 컨소시엄을 구성해 설계에서부터 기자재 공급, 설치, 시운전에 이르기까지 전 공정을 일괄 수행하는 EPC 방식으로 2028년까지 발전소를 준공할 예정이다.

사우디 전력조달청(SPCC)이 국제입찰로 발주한 루마1과 나이리야1 프로젝트는 각각 리야드 북동쪽 80㎞와 470㎞ 떨어진 곳에 1800MW급 가스복합발전소를 1기씩 건설한다. 또 향후 25년간 생산된 전력을 SPPC에 판매할 예정이다.

한전 컨소시엄은 지난해 11월 SPPC와 전력판매계약(PPA)을 체결한 바 있다.

이현호 두산에너빌리티 Plant EPC BG장은 ""이번 계약은 중동 지역의 에너지 수요 증가와 맞물려 두산에너빌리티의 건설 수행 기술과 경쟁력을 국제 무대에서 다시 한번 입증한 사례""라고 밝혔다.

최근 사우디아라비아의 전력 수요는 꾸준히 증가하고 있다. 시장조사기관 모르도르 인텔리전스에 따르면 사우디아라비아 전력 설비 규모는 2025년 92.9GW에서 2030년 123.2GW로 증가해 연평균 6GW 규모의 발전소가 증설될 전망이다.

한편 두산에너빌리티는 전날 글로벌 해양풍력 시장 1위 업체인 지멘스가메사와 손을 잡고 창원에 풍력발전기 공장을 설립한다고 밝힌 바 있다. 

김두용 기자"
0004460763,네이버,한국전력,2025-03-13T09:46:00+09:00,또 사우디에 가스발전소…두산에너빌 2.2조 '잭팟',"수도 인근에 1800㎿급 2기 건설
현지 전력조달청에 25년간 공급
[서울경제]

두산에너빌리티(034020)가 2조 2000억 원 규모의 사우디아라비아 가스복합발전소 건설 사업을 수주했다.



두산에너빌리티는 한국전력(015760)공사 컨소시엄과 ‘사우디 루마1·나이리야1 가스복합발전소’ 건설 계약을 체결했다고 13일 밝혔다. 프로젝트 개발 사업자인 한전 컨소시엄은 한전과 사우디 전력공사(SEC), 사우디 최대 민자발전사인 ‘ACWA 파워’로 구성됐다.

두산에너빌리티는 발전소 건설 전문 기업인 셉코3과 별도 컨소시엄을 꾸려 2028년까지 발전소를 준공할 계획이다. 공사는 설계부터 기자재 공급·설치·시운전에 이르는 전 공정을 일괄 수행하는 EPC(설계·조달·시공) 방식으로 진행된다.

사우디 전력조달청(SPCC)이 국제 입찰로 발주한 루마1·나이리야1 프로젝트는 사우디 수도인 리야드에서 북동쪽으로 각각 80㎞, 470㎞ 떨어진 곳에 1800㎿급 가스복합발전소를 1기씩 건설하는 사업. 향후 25년간 생산된 전력을 SPCC에 판매한다. 한전 컨소시엄은 지난해 11월 SPPC와 전력판매계약(PPA)을 체결했다.

최근 사우디의 전력 수요는 꾸준히 증가하고 있다. 시장 조사기관 모르도르 인텔리전스에 따르면 사우디 전력설비 규모는 올 해 92.9GW에서 2030년 123.2GW로 늘어날 것으로 전망됐다. 두산이 수주한 루마1·나이리야1급 프로젝트가 매년 3~4개씩 필요하다는 얘기다.

앞서 두산에너빌리티 등 한전 컨소시엄은 2022년 사우디 자푸라 지역에서 열병합발전 건설 계약을 따냈다. 하반기 준공 예정인 자푸라 프로젝트는 320㎿급 규모의 전력과 시간당 314톤의 증기를 생산해 인근 자푸라 가스전에 공급한다. 두산에너빌리티는 사우디에서 주단조 공장과 해수담수화플랜트 계약 등을 따내기도 했다.

이현호 두산에너빌리티 플랜트EPC 그룹장은 “중동 지역의 에너지 수요 증가와 맞물려 두산의 건설 수행 기술과 경쟁력을 다시 한 번 입증했다”며 “사우디내 안정적 전력 공급을 위해 최선을 다하겠다”고 말했다."
0003292706,네이버,한국전력,2025-03-13T09:41:00+09:00,"두산에너빌리티, 사우디서 2.2조원 가스복합발전소 계약","두산에너빌리티가 건설공사 계약을 체결한 사우디아라비아 루마1, 나이리야1 가스복합발전소 위치

두산에너빌리티가 2조2000억원 규모의 사우디아라비아 가스복합발전소 공사계약을 체결했다.

두산에너빌리티는 프로젝트 디벨로퍼(개발사업자)인 한국전력공사 컨소시엄과 '사우디 루마1, 나이리야1 가스복합발전소' 건설공사 계약을 체결했다고 13일 밝혔다.

두산에너빌리티는 발전소 건설 전문회사인 셉코3과 컨소시엄으로 설계에서부터 기자재 공급, 설치, 시운전에 이르기까지 전 공정을 일괄 수행하는 EPC 방식으로 2028년까지 준공할 예정이다. 두산에너빌리티의 수주 규모만 2조2000억원에 이른다.

사우디 전력조달청(SPPC)이 국제입찰로 발주한 루마1과 나이리야1 프로젝트는, 각각 리야드 북동쪽 80㎞와 470㎞ 떨어진 곳에 1800㎿급 가스복합발전소를 1기씩 건설해, 향후 25년간 생산된 전력을 SPPC에 판매하는 사업이다. 한전 컨소시엄은 지난 해 11월 SPPC와 전력판매계약(PPA)을 체결했다.

이현호 두산에너빌리티 플랜트 EPC BG장은 “이번 계약은 중동 지역의 에너지 수요 증가와 맞물려 두산에너빌리티의 건설 수행 기술과 경쟁력을 국제 무대에서 다시 한번 입증한 사례”라며 “사우디아라비아 내 안정적인 전력 공급을 위해 최선을 다 하겠다”고 말했다.

최근 사우디아라비아의 전력 수요는 꾸준히 증가하고 있다. 시장조사기관 모르도르 인텔리전스에 따르면 사우디아라비아 전력설비 규모가 2025년 92.9GW에서 2030년 123.2GW로 연평균 6GW 규모의 발전소가 증설될 전망이다."
0000372161,네이버,한국전력,2025-03-13T09:37:00+09:00,"두산에너빌리티, 사우디서 2.2조원 규모 가스복합발전소 계약","개발사업자 한전 컨소시엄과 EPC 계약 체결
루마1, 나이리야1 총 3600㎽ 규모

두산에너빌리티가 2조2000억원 규모의 사우디아라비아 가스복합발전소 공사계약을 체결했다. 두산에너빌리티가 건설공사 계약을 체결한 사우디아라비아 루마1, 나이리야1 가스복합발전소 위치. /두산에너빌리티


두산에너빌리티가 2조2000억원 규모의 사우디아라비아 가스복합발전소 공사계약을 체결했다.

두산에너빌리티는 개발사업자인 한국전력공사 컨소시엄과 '사우디 루마1, 나이리야1 가스복합발전소' 건설공사 계약을 체결했다고 13일 밝혔다. 두산에너빌리티는 발전소 건설 전문회사인 셉코3(SEPCO-3)와 컨소시엄으로 설계에서부터 기자재 공급, 설치, 시운전에 이르기까지 전 공정을 일괄 수행하는 EPC 방식으로 2028년까지 준공할 예정이다.

사우디 전력조달청(이하 SPPC)이 국제입찰로 발주한 루마1과 나이리야1 프로젝트는 각각 리야드 북동쪽 80㎞와 470㎞ 떨어진 곳에 1800㎽급 가스복합발전소를 1기씩 건설해, 향후 25년간 생산된 전력을 SPPC에 판매하는 사업이다. 한전 컨소시엄은 지난해 11월 SPPC와 전력판매계약(PPA)을 체결했다.

이현호 두산에너빌리티 Plant EPC BG장은 ""이번 계약은 중동 지역의 에너지 수요 증가와 맞물려 두산에너빌리티의 건설 수행 기술과 경쟁력을 국제 무대에서 다시 한번 입증한 사례""라며 ""사우디아라비아 내 안정적인 전력 공급을 위해 최선을 다 하겠다""고 말했다.

최근 사우디아라비아의 전력 수요는 꾸준히 증가하고 있다. 시장조사기관 모르도르 인텔리전스(Mordor Intelligence)에 따르면 사우디아라비아 전력설비 규모는 2025년 92.9GW에서 2030년 123.2GW로, 연평균 6GW 규모의 발전소가 증설될 전망이다.

발로 뛰는 더팩트는 24시간 여러분의 제보를 기다립니다.
▶카카오톡: '더팩트제보' 검색
▶이메일: jebo@tf.co.kr
▶뉴스 홈페이지: http://talk.tf.co.kr/bbs/report/write"
0013116512,네이버,한국전력,2025-03-13T09:32:00+09:00,"두산에너빌리티, 2.2조원 사우디 가스복합발전소 계약","[서울=뉴시스] 두산에너빌리티가 건설공사 계약을 체결한 사우디아라비아 루마1, 나이리야1 가스복합발전소 위치. (사진=두산에너빌리티 제공) 2025.3.13. photo@newsis.com *재판매 및 DB 금지


[서울=뉴시스] 류인선 기자 = 두산에너빌리티가 2조2000억원 규모의 사우디아라비아 가스복합발전소 공사 계약을 따냈다.

두산에너빌리티는 프로젝트 디벨로퍼(개발사업자)인 한국전력공사 컨소시엄과 '사우디 루마1, 나이리야1 가스복합발전소' 건설공사 계약을 체결했다고 13일 밝혔다.

두산에너빌리티는 발전소 건설 전문회사인 셉코3(SEPCO-3)와 컨소시엄으로 설계에서부터 기자재 공급, 설치, 시운전에 이르기까지 전 공정을 일괄 수행하는 방식(EPC)으로 2028년까지 준공할 예정이다.

사우디 전력조달청(이하 SPPC)이 국제입찰로 발주한 루마1과 나이리야1 프로젝트는, 각각 리야드 북동쪽 80㎞와 470㎞ 떨어진 곳에 1800메가와트(㎿)급 가스복합발전소를 1기씩 건설하는 사업이다.

이 곳에서 생산된 전력은 앞으로 25년간 SPPC에 판매한다. 한전 컨소시엄은 지난해 11월 SPPC와 전력판매계약(PPA)을 체결한 바 있다.

이현호 두산에너빌리티 플랜트 EPC 사업부문(BG)장은 ""이번 계약은 중동 지역의 에너지 수요 증가와 맞물려 두산에너빌리티의 건설 수행 기술과 경쟁력을 국제 무대에서 다시 한번 입증한 사례""라고 말했다."
0015262474,네이버,한국전력,2025-03-13T09:31:00+09:00,"두산에너빌, 사우디서 2.2조원 규모 가스복합발전소 건설계약","한전 컨소시엄과 EPC 계약…루마1·나이리야1 총 3천600MW 건설


두산에너빌리티, 사우디서 2.2조원 규모 가스복합발전소 수주
[두산에너빌리티 제공. 재판매 및 DB 금지]


(서울=연합뉴스) 김보경 기자 = 두산에너빌리티가 2조2천억원 규모의 사우디아라비아 가스복합발전소 공사계약을 체결했다.

두산에너빌리티는 프로젝트 디벨로퍼(개발사업자)인 한국전력공사 컨소시엄과 '사우디 루마1, 나이리야1 가스복합발전소' 건설공사 계약을 체결했다고 13일 밝혔다.

한전 컨소시엄은 한전과 사우디 전력공사(SEC), 사우디 최대 민자 발전사로 구성됐다.

두산에너빌리티는 발전소 건설 전문회사인 셉코3와 컨소시엄을 구성해 설계에서부터 기자재 공급, 설치, 시운전에 이르기까지 전 공정을 일괄 수행하는 EPC 방식으로 2028년까지 발전소를 준공할 예정이다.

사우디 전력조달청(SPCC)이 국제입찰로 발주한 루마1과 나이리야1 프로젝트는 각각 리야드 북동쪽 80㎞와 470㎞ 떨어진 곳에 1천800MW(메가와트)급 가스복합발전소를 1기씩 건설한다. 또 향후 25년간 생산된 전력을 SPPC에 판매할 예정이다.

한전 컨소시엄은 지난 해 11월 SPPC와 전력판매계약(PPA)을 체결한 바 있다.

두산에너빌리티 이현호 Plant EPC BG장은 ""이번 계약은 중동 지역의 에너지 수요 증가와 맞물려 두산에너빌리티의 건설 수행 기술과 경쟁력을 국제 무대에서 다시 한번 입증한 사례""라고 밝혔다.

최근 사우디아라비아의 전력 수요는 꾸준히 증가하고 있다.

시장조사기관 모르도르 인텔리전스에 따르면 사우디아라비아 전력 설비 규모는 2025년 92.9GW(기가와트)에서 2030년 123.2GW로 증가해 연평균 6GW 규모의 발전소가 증설될 전망이다.

vivid@yna.co.kr"
